,fulltext,keywords,summary,url
0,"It's been a hellish month for Apple, but here's how you can play for a comeback

6:10 PM ET Fri, 31 May 2019

A win-win Apple trade, with CNBC's Melissa Lee and the Options Action traders, Carter Worth, Mike Khouw and Dan Nathan.","['comeback', 'month', 'nathan', 'apple', 'play', 'winwin', 'heres', 'trade', 'hellish', 'mike', 'worth', 'traders', 'options']","It's been a hellish month for Apple, but here's how you can play for a comeback6:10 PM ET Fri, 31 May 2019A win-win Apple trade, with CNBC's Melissa Lee and the Options Action traders, Carter Worth, Mike Khouw and Dan Nathan.",https://www.cnbc.com/video/2019/05/31/its-been-hellish-month-for-apple-but-heres-how-you-can-play-for-a-comeback.html
1,"This page has not been authorized, sponsored, or otherwise approved or endorsed by the companies represented herein. Each of the company logos represented herein are trademarks of Verizon Media; Microsoft Corporation; Nasdaq, Inc.; Dow Jones & Company; Forbes Media, LLC; Investor's Business Daily, Inc.; and Morningstar, Inc.

Copyright 2019 Zacks Investment Research | 10 S Riverside Plaza Suite #1600 | Chicago, IL 60606

At the center of everything we do is a strong commitment to independent research and sharing its profitable discoveries with investors. This dedication to giving investors a trading advantage led to the creation of our proven Zacks Rank stock-rating system. Since 1988 it has more than doubled the S&P 500 with an average gain of +24.80% per year. These returns cover a period from January 1, 1988 through July 1, 2019. Zacks Rank stock-rating system returns are computed monthly based on the beginning of the month and end of the month Zacks Rank stock prices plus any dividends received during that particular month. A simple, equally-weighted average return of all Zacks Rank stocks is calculated to determine the monthly return. The monthly returns are then compounded to arrive at the annual return. Only Zacks Rank stocks included in Zacks hypothetical portfolios at the beginning of each month are included in the return calculations. Zacks Ranks stocks can, and often do, change throughout the month. Certain Zacks Rank stocks for which no month-end price was available, pricing information was not collected, or for certain other reasons have been excluded from these return calculations.

Visit performance for information about the performance numbers displayed above.

Visit www.zacksdata.com to get our data and content for your mobile app or website.

Real time prices by BATS. Delayed quotes by Sungard.

NYSE and AMEX data is at least 20 minutes delayed. NASDAQ data is at least 15 minutes delayed.","['month', 'returns', 'zacks', 'apple', 'fronts', 'stocks', 'trade', 'impact', 'return', 'investors', 'war', 'delayed', 'aapl', 'data', 'rank', 'monthly', 'faces']","This dedication to giving investors a trading advantage led to the creation of our proven Zacks Rank stock-rating system.
Zacks Rank stock-rating system returns are computed monthly based on the beginning of the month and end of the month Zacks Rank stock prices plus any dividends received during that particular month.
A simple, equally-weighted average return of all Zacks Rank stocks is calculated to determine the monthly return.
Only Zacks Rank stocks included in Zacks hypothetical portfolios at the beginning of each month are included in the return calculations.
Certain Zacks Rank stocks for which no month-end price was available, pricing information was not collected, or for certain other reasons have been excluded from these return calculations.",http://www.zacks.com/stock/news/423229/apple-aapl-faces-trade-war-impact-on-two-fronts?cid=CS-SEEKAPH-FT-423229
2,"Wearables, Home and Accessories revenue is growing

Apple (AAPL) continues to rule the roost in the wearables segment. The company’s latest smartwatch, the Apple Watch Series 4, has seen a lot of traction due to its increased health features.

During the quarter that ended in March, the tech giant made $5.13 billion from its Wearables, Home and Accessories segment, a rise of 30.0% over the same quarter last year. The segment made up 8.8% of Apple’s total revenue.

According to the latest report by the IDC, Apple sold 4.6 million wrist-worn devices during the first quarter of 2019, a rise of 14.8% YoY (year-over-year). Xiaomi (XIACF) overtook Apple as the leader in the segment, selling 5.3 million units during the quarter, a rise of 43.6% YoY.

Fitbit continued to lag the leaders

Meanwhile, Fitbit (FIT), which was once the leader in the segment, fell further behind its peers, selling only 2.9 million wrist-worn devices, a rise of 35.9% YoY. The company was leapfrogged by Huawei, which saw tremendous growth and sold 3.9 million units in the quarter.

Fitbit has fallen to fifth place in the wearables space, according to the IDC. While the company is seeing recovery, its stock has fallen nearly 30% since February 2019.

The wearables segment as a whole, which has been struggling in recent years, saw some revival in the first quarter. The sector saw a total of 49.6 million shipments, an increase of 55.2% YoY. Wrist-worn devices saw a total of 31.3 million devices shipped in the quarter, an increase of 31.6% YoY. Apple was the clear leader in overall wearables shipments in the quarter.","['segment', 'devices', 'quarter', 'apple', 'saw', 'continues', 'yoy', 'rule', 'rise', 'million', 'roost', 'wristworn', 'wearables']","Wearables, Home and Accessories revenue is growingApple (AAPL) continues to rule the roost in the wearables segment.
According to the latest report by the IDC, Apple sold 4.6 million wrist-worn devices during the first quarter of 2019, a rise of 14.8% YoY (year-over-year).
The wearables segment as a whole, which has been struggling in recent years, saw some revival in the first quarter.
Wrist-worn devices saw a total of 31.3 million devices shipped in the quarter, an increase of 31.6% YoY.
Apple was the clear leader in overall wearables shipments in the quarter.",https://marketrealist.com/2019/05/apple-continues-to-rule-the-roost-in-wearables?utm_source=seeking-alpha-headline&utm_medium=feed&utm_content=main_permalink&utm_campaign=apple-continues-to-rule-the-roost-in-wearables
3,"This page has not been authorized, sponsored, or otherwise approved or endorsed by the companies represented herein. Each of the company logos represented herein are trademarks of Verizon Media; Microsoft Corporation; Nasdaq, Inc.; Dow Jones & Company; Forbes Media, LLC; Investor's Business Daily, Inc.; and Morningstar, Inc.

Copyright 2019 Zacks Investment Research | 10 S Riverside Plaza Suite #1600 | Chicago, IL 60606

At the center of everything we do is a strong commitment to independent research and sharing its profitable discoveries with investors. This dedication to giving investors a trading advantage led to the creation of our proven Zacks Rank stock-rating system. Since 1988 it has more than doubled the S&P 500 with an average gain of +24.80% per year. These returns cover a period from January 1, 1988 through July 1, 2019. Zacks Rank stock-rating system returns are computed monthly based on the beginning of the month and end of the month Zacks Rank stock prices plus any dividends received during that particular month. A simple, equally-weighted average return of all Zacks Rank stocks is calculated to determine the monthly return. The monthly returns are then compounded to arrive at the annual return. Only Zacks Rank stocks included in Zacks hypothetical portfolios at the beginning of each month are included in the return calculations. Zacks Ranks stocks can, and often do, change throughout the month. Certain Zacks Rank stocks for which no month-end price was available, pricing information was not collected, or for certain other reasons have been excluded from these return calculations.

Visit performance for information about the performance numbers displayed above.

Visit www.zacksdata.com to get our data and content for your mobile app or website.

Real time prices by BATS. Delayed quotes by Sungard.

NYSE and AMEX data is at least 20 minutes delayed. NASDAQ data is at least 15 minutes delayed.","['analyst', 'month', 'ibm', 'amazon', 'returns', 'zacks', 'apple', 'stocks', 'sap', 'return', 'investors', 'facebook', 'highlights', 'delayed', 'data', 'blog', 'rank', 'monthly', 'alphabet']","This dedication to giving investors a trading advantage led to the creation of our proven Zacks Rank stock-rating system.
Zacks Rank stock-rating system returns are computed monthly based on the beginning of the month and end of the month Zacks Rank stock prices plus any dividends received during that particular month.
A simple, equally-weighted average return of all Zacks Rank stocks is calculated to determine the monthly return.
Only Zacks Rank stocks included in Zacks hypothetical portfolios at the beginning of each month are included in the return calculations.
Certain Zacks Rank stocks for which no month-end price was available, pricing information was not collected, or for certain other reasons have been excluded from these return calculations.",http://www.zacks.com/stock/news/423094/the-zacks-analyst-blog-highlights-facebook-alphabet-apple-amazon-ibm-and-sap?cid=CS-SEEKAPH-FT-423094
4,"It looks like you have reached this page in error ...

The content you are looking for has either moved, or if you typed in the address there might have been a mistake.

If you believe there has been a technical error – please let us know.

Most Popular Destinations","['popular', 'moved', '404', 'typed', 'reached', 'error', 'looking', 'mistakeif', 'page', 'looks', 'technical']","It looks like you have reached this page in error ...
The content you are looking for has either moved, or if you typed in the address there might have been a mistake.
If you believe there has been a technical error – please let us know.
Most Popular Destinations",https://www.bnn.ca/Video/player.aspx?vid=1696328
